{
  "schema_version": 1,
  "id": "eb-reduced",
  "name": "D · Etilbenzeno — R1 reduzido",
  "model": "eb-reduced",
  "experiment": {
    "dt": 72.0,
    "duration": 2160.0,
    "controller": "manual",
    "observer": "ekf",
    "setpoint": 160.0,
    "manual": 21828692.029215917,
    "disturbance_time": 720.0,
    "disturbance_value": 1.0,
    "sensor_sigma": 0.1,
    "initial_estimate_offset": 0.05,
    "seed": 42,
    "solver": "RK45",
    "rtol": 1e-07,
    "atol": 1e-09,
    "kp": 7000.0,
    "ki": 100.0,
    "kd": 0.0,
    "horizon": 8,
    "sensor_period": 1,
    "sensor_delay": 0,
    "sensor_dropout": 0.0,
    "sensor_bias": 0.0,
    "sensor_drift": 0.0,
    "sensor_lag": 0.0,
    "sensor_quantization": 0.0,
    "sensor_min": -1000.0,
    "sensor_max": 2000.0,
    "chemical_period": 0,
    "chemical_delay": 0,
    "chemical_sigma": 0.02,
    "q_scale": 1.0,
    "r_scale": 1.0,
    "control_target": "temperature"
  }
}
