{
  "schema_version": 1,
  "id": "basic-flowsheet",
  "name": "A · Mistura e aquecimento",
  "model": "flowsheet",
  "nodes": [
    {
      "id": "F-101",
      "kind": "source",
      "label": "F-101",
      "parameters": {
        "flow": 1.0,
        "temperature": 295.15,
        "fraction": 0.1,
        "pressure": 101325.0
      },
      "layout": {
        "x": 10,
        "y": 30
      }
    },
    {
      "id": "F-102",
      "kind": "source",
      "label": "F-102",
      "parameters": {
        "flow": 0.5,
        "temperature": 315.15,
        "fraction": 0.3,
        "pressure": 101325.0
      },
      "layout": {
        "x": 10,
        "y": 210
      }
    },
    {
      "id": "M-101",
      "kind": "mixer",
      "label": "M-101",
      "parameters": {},
      "layout": {
        "x": 230,
        "y": 100
      }
    },
    {
      "id": "H-101",
      "kind": "heater",
      "label": "H-101",
      "parameters": {
        "duty": 15000.0
      },
      "layout": {
        "x": 430,
        "y": 100
      }
    },
    {
      "id": "T-101",
      "kind": "tank",
      "label": "T-101",
      "parameters": {
        "volume": 0.1,
        "temperature": 300.0,
        "fraction": 0.15,
        "duty": 0.0
      },
      "layout": {
        "x": 630,
        "y": 100
      }
    },
    {
      "id": "P-101",
      "kind": "sink",
      "label": "P-101",
      "parameters": {},
      "layout": {
        "x": 830,
        "y": 100
      }
    }
  ],
  "edges": [
    {
      "id": "S-1",
      "source": "F-101",
      "target": "M-101",
      "source_port": "out",
      "target_port": "in1",
      "kind": "material"
    },
    {
      "id": "S-2",
      "source": "F-102",
      "target": "M-101",
      "source_port": "out",
      "target_port": "in2",
      "kind": "material"
    },
    {
      "id": "S-3",
      "source": "M-101",
      "target": "H-101",
      "source_port": "out",
      "target_port": "in",
      "kind": "material"
    },
    {
      "id": "S-4",
      "source": "H-101",
      "target": "T-101",
      "source_port": "out",
      "target_port": "in",
      "kind": "material"
    },
    {
      "id": "S-5",
      "source": "T-101",
      "target": "P-101",
      "source_port": "out",
      "target_port": "in",
      "kind": "material"
    }
  ],
  "experiment": {
    "manual": 0.0,
    "controller": "manual",
    "setpoint": 304.2082145,
    "disturbance_value": 0.0,
    "dt": 5.0,
    "duration": 600.0,
    "seed": 42,
    "solver": "RK45",
    "rtol": 1e-07,
    "atol": 1e-09,
    "observer": "ekf",
    "kp": 7000.0,
    "ki": 100.0,
    "kd": 0.0,
    "horizon": 8,
    "sensor_sigma": 0.1,
    "sensor_period": 1,
    "sensor_delay": 0,
    "sensor_dropout": 0.0,
    "sensor_bias": 0.0,
    "sensor_drift": 0.0,
    "sensor_lag": 0.0,
    "sensor_quantization": 0.0,
    "sensor_min": -1000.0,
    "sensor_max": 2000.0,
    "chemical_period": 0,
    "chemical_delay": 0,
    "chemical_sigma": 0.02,
    "q_scale": 1.0,
    "r_scale": 1.0,
    "disturbance_time": 200.0,
    "initial_estimate_offset": 0.1,
    "control_target": "temperature"
  }
}
