{
  "schema_version": 1,
  "id": "pg-original",
  "name": "C · Propilenoglicol — modelo original",
  "model": "pg-original",
  "experiment": {
    "dt": 54.0,
    "duration": 2160.0,
    "controller": "pid",
    "observer": "ukf",
    "manual": 453.59237,
    "setpoint": 332.333618,
    "kp": 20.0,
    "ki": 0.02,
    "disturbance_time": 540.0,
    "disturbance_value": 2.0,
    "chemical_period": 10,
    "chemical_delay": 3,
    "sensor_sigma": 0.15,
    "initial_estimate_offset": 0.1,
    "seed": 42,
    "solver": "RK45",
    "rtol": 1e-07,
    "atol": 1e-09,
    "kd": 0.0,
    "horizon": 8,
    "sensor_period": 1,
    "sensor_delay": 0,
    "sensor_dropout": 0.0,
    "sensor_bias": 0.0,
    "sensor_drift": 0.0,
    "sensor_lag": 0.0,
    "sensor_quantization": 0.0,
    "sensor_min": -1000.0,
    "sensor_max": 2000.0,
    "chemical_sigma": 0.02,
    "q_scale": 1.0,
    "r_scale": 1.0,
    "control_target": "temperature"
  }
}
